{
  "schemaVersion": 1,
  "id": "d889dd66-ccfb-42ad-98d6-ca7b5b75d8cd",
  "changeSetId": "11111111-1111-4111-8111-111111111111",
  "createdAt": "2026-07-15T12:00:00.000Z",
  "entries": [
    {
      "kind": "engine",
      "engineVersion": "2.1.0-fixture",
      "supportsJsonSchema": true,
      "supportsSessionResume": true
    }
  ]
}
